{
  "schemaVersion": 3,
  "tripId": "golden-reference-2027",
  "enabled": true,
  "notice": "POC：Japan Live Cam 已改成 Standard cameras[] + days[]；唔再依賴 live.html 內置 camera template。",
  "cameras": [
    {
      "id": "shinhotaka-official",
      "title": "新穗高纜車・官方運行／Live",
      "type": "official",
      "sourceUrl": "https://shinhotaka-ropeway.jp/",
      "sourceLabel": "官方來源",
      "priority": "must",
      "desc": "D6 出發前自行確認運行、能見度及風況。",
      "map": "新穂高ロープウェイ",
      "tags": [
        "運行",
        "能見度"
      ]
    },
    {
      "id": "gifu-road",
      "title": "岐阜道路資訊",
      "type": "official",
      "sourceUrl": "https://douro.pref.gifu.lg.jp/",
      "sourceLabel": "道路官方",
      "priority": "must",
      "desc": "冬季道路、積雪及管制。",
      "tags": [
        "道路",
        "積雪"
      ]
    },
    {
      "id": "shirakawago-official",
      "title": "白川鄉・官方交通資訊",
      "type": "official",
      "sourceUrl": "https://shirakawa-going.jp/tw/index.html",
      "sourceLabel": "官方交通",
      "priority": "must",
      "desc": "D7 交通及管制參考。",
      "map": "Shirakawa-go Ogimachi",
      "tags": [
        "交通",
        "白川鄉"
      ]
    },
    {
      "id": "takayama-official",
      "title": "飛驒高山 Live／觀光資訊",
      "type": "official",
      "sourceUrl": "https://www.hidatakayama.or.jp/",
      "sourceLabel": "官方來源",
      "priority": "ref",
      "desc": "高山市區天氣及旅遊資訊。",
      "map": "Takayama Station",
      "tags": [
        "高山"
      ]
    }
  ],
  "days": [
    {
      "id": "d6",
      "label": "D6",
      "date": "2027-01-14",
      "title": "新穗高固定日",
      "desc": "只提供資訊；不自動換日。",
      "route": "高山 → 新穗高 → 平湯 → 高山",
      "cameras": [
        "shinhotaka-official",
        "gifu-road"
      ],
      "places": [
        {
          "label": "新穗高纜車",
          "map": "新穂高ロープウェイ"
        }
      ],
      "officialLinks": [
        {
          "label": "新穗高官方",
          "url": "https://shinhotaka-ropeway.jp/"
        }
      ]
    },
    {
      "id": "d7",
      "label": "D7",
      "date": "2027-01-15",
      "title": "白川鄉固定日",
      "desc": "道路與交通資料供人手判斷。",
      "route": "高山 → 白川鄉 → 高山",
      "cameras": [
        "shirakawago-official",
        "gifu-road"
      ],
      "places": [
        {
          "label": "白川鄉",
          "map": "Shirakawa-go Ogimachi"
        }
      ],
      "officialLinks": [
        {
          "label": "白川鄉交通",
          "url": "https://shirakawa-going.jp/tw/index.html"
        }
      ]
    },
    {
      "id": "d8",
      "label": "D8",
      "date": "2027-01-16",
      "title": "高山市區 → 松本",
      "desc": "向東返松本。",
      "route": "高山 → 平湯／安房 → 松本",
      "cameras": [
        "takayama-official",
        "gifu-road"
      ],
      "places": [
        {
          "label": "松本",
          "map": "Matsumoto Station"
        }
      ],
      "officialLinks": []
    }
  ]
}
